{
 "task_id": "fr-09",
 "task_family": "multi_constraint_focused_revision",
 "title": "Rooftop — scattered overwriting",
 "source_passage": "The city sprawled beneath them like an infinite circuit board of longing and regret. Kell checked the rope. 'We should go,' I said, though it was Kell who had spoken. The night was the profound and total absence of everything that mattered. 'We should go,' Kell said. Below, a siren rose and fell.",
 "user_context": "This is overcooked in places and the point of view slips. Clean it.",
 "compiler_inputs": {
  "user_request": "This is overcooked in places and the point of view slips. Clean it.",
  "source_passage": "The city sprawled beneath them like an infinite circuit board of longing and regret. Kell checked the rope. 'We should go,' I said, though it was Kell who had spoken. The night was the profound and total absence of everything that mattered. 'We should go,' Kell said. Below, a siren rose and fell.",
  "project_context": "",
  "scene_context": "",
  "canon_records": [],
  "voice_profile": "third-person limited on Kell, past tense, lean",
  "character_state": "",
  "invention_budget": "none"
 },
 "evaluation_ground_truth": {
  "required_changes": [
   {
    "id": "rc1",
    "desc": "cut the overwrought skyline metaphor",
    "defect_type": "overwritten_metaphor",
    "check": {
     "t": "absent",
     "v": "an infinite circuit board of longing and regret"
    }
   },
   {
    "id": "rc2",
    "desc": "trim the abstract night description",
    "defect_type": "excessive_abstraction",
    "check": {
     "t": "absent",
     "v": "the profound and total absence of everything that mattered"
    }
   },
   {
    "id": "rc3",
    "desc": "the mis-attributed duplicate 'We should go' line must go",
    "defect_type": "redundant_dialogue",
    "check": {
     "t": "absent",
     "v": "'We should go,' I said, though it was Kell who had spoken"
    }
   },
   {
    "id": "rc4",
    "desc": "remove the first-person slip; the POV is limited to Kell",
    "defect_type": "viewpoint_drift",
    "check": {
     "t": "absent",
     "v": "I said"
    }
   }
  ],
  "protected_elements": [
   {
    "id": "p1",
    "text": "Below, a siren rose and fell."
   }
  ],
  "forbidden_changes": [
   {
    "id": "f1",
    "desc": "keep Kell as the viewpoint character",
    "check": {
     "t": "present",
     "v": "Kell"
    }
   },
   {
    "id": "f2",
    "desc": "do not add a fall, jump, or death",
    "check": {
     "t": "absent",
     "v": "jumped"
    }
   }
  ],
  "authorized_spans": [
   {
    "id": "a1",
    "desc": "the two metaphors and the mis-attributed line may be rewritten"
   }
  ],
  "unaffected_spans": [
   {
    "id": "u1",
    "text": "Kell checked the rope."
   }
  ],
  "required_facts": [],
  "forbidden_facts": [],
  "expected_output_shape": "prose",
  "valid_no_change_case": false
 },
 "machine_checks": {
  "required_change_checks": [
   {
    "id": "rc1",
    "kind": "overwritten_metaphor",
    "check": {
     "t": "absent",
     "v": "an infinite circuit board of longing and regret"
    }
   },
   {
    "id": "rc2",
    "kind": "excessive_abstraction",
    "check": {
     "t": "absent",
     "v": "the profound and total absence of everything that mattered"
    }
   },
   {
    "id": "rc3",
    "kind": "redundant_dialogue",
    "check": {
     "t": "absent",
     "v": "'We should go,' I said, though it was Kell who had spoken"
    }
   },
   {
    "id": "rc4",
    "kind": "viewpoint_drift",
    "check": {
     "t": "absent",
     "v": "I said"
    }
   }
  ],
  "protected_text_checks": [
   {
    "id": "p1",
    "kind": "exact_preservation",
    "check": {
     "t": "preserve",
     "v": "Below, a siren rose and fell."
    }
   }
  ],
  "forbidden_change_checks": [
   {
    "id": "f1",
    "kind": "forbidden_guard",
    "check": {
     "t": "present",
     "v": "Kell"
    }
   },
   {
    "id": "f2",
    "kind": "forbidden_guard",
    "check": {
     "t": "absent",
     "v": "jumped"
    }
   }
  ],
  "output_shape_checks": [],
  "returned_unchanged_check": {
   "normalization": {
    "trim_outer_whitespace": true,
    "normalize_line_endings": true
   },
   "comparison": "exact_after_normalization"
  },
  "partial_fix_checks": [
   "rc1",
   "rc2",
   "rc3",
   "rc4"
  ],
  "unauthorized_edit_checks": [
   {
    "id": "u1",
    "kind": "unaffected_exact",
    "check": {
     "t": "preserve",
     "v": "Kell checked the rope."
    }
   }
  ]
 },
 "diagnostics": {
  "instruction_position": "early",
  "critical_instruction_type": "required_correction",
  "critical_instruction_ordinal": 1,
  "defect_count": 4,
  "difficulty": "high",
  "context_length_class": "medium",
  "voice_dependency": false,
  "canon_dependency": false
 },
 "gold_acceptance_requirements": {
  "contract_execution_required": true,
  "manuscript_quality_required": true,
  "acceptable_output_properties": [
   "single clean 'We should go' beat",
   "consistent limited POV on Kell",
   "lean imagery replaces the purple lines"
  ]
 },
 "benchmark_policy": {
  "benchmark_only": true,
  "excluded_from_training": true,
  "excluded_from_teacher_examples": true,
  "excluded_from_dataset_revision_examples": true,
  "excluded_from_preference_data": true,
  "immutable_after_freeze": true
 },
 "comprehension_probe": {
  "enabled": false
 }
}