{
 "task_id": "sp-01",
 "task_family": "structured_protocol",
 "title": "Scene-card extraction",
 "source_passage": "The heist went wrong the moment the lights came back on. Dain froze in the vault doorway while the alarm climbed. Behind him, Sera was already gone.",
 "user_context": "Read the passage and return ONLY a JSON object with exactly these keys: \"pov_character\" (the point-of-view character's name), \"setting\" (one short phrase), and \"tension\" (one sentence naming the central tension). Do not include any prose outside the JSON.",
 "compiler_inputs": {
  "user_request": "Read the passage and return ONLY a JSON object with exactly these keys: \"pov_character\" (the point-of-view character's name), \"setting\" (one short phrase), and \"tension\" (one sentence naming the central tension). Do not include any prose outside the JSON.",
  "source_passage": "The heist went wrong the moment the lights came back on. Dain froze in the vault doorway while the alarm climbed. Behind him, Sera was already gone.",
  "project_context": "tooling task: convert a passage into a structured scene card",
  "scene_context": "",
  "canon_records": [],
  "voice_profile": "",
  "character_state": "",
  "invention_budget": "none: extract only what the passage states"
 },
 "evaluation_ground_truth": {
  "required_changes": [
   {
    "id": "rc1",
    "desc": "output must be a JSON object with the three required keys",
    "defect_type": "schema_valid",
    "check": {
     "t": "shape_json",
     "keys": [
      "pov_character",
      "setting",
      "tension"
     ]
    }
   },
   {
    "id": "rc2",
    "desc": "the pov_character is Dain",
    "defect_type": "required_fact_present",
    "check": {
     "t": "present",
     "v": "Dain"
    }
   }
  ],
  "protected_elements": [],
  "forbidden_changes": [
   {
    "id": "f1",
    "desc": "do not invent a character not in the passage",
    "check": {
     "t": "absent",
     "v": "guard"
    }
   },
   {
    "id": "f2",
    "desc": "do not add keys beyond the three requested",
    "check": {
     "t": "absent",
     "v": "summary"
    }
   }
  ],
  "authorized_spans": [
   {
    "id": "a1",
    "desc": "the whole output is authored as the requested JSON"
   }
  ],
  "unaffected_spans": [],
  "required_facts": [
   "Dain as pov_character"
  ],
  "forbidden_facts": [
   "a fourth key"
  ],
  "expected_output_shape": "json",
  "valid_no_change_case": false
 },
 "machine_checks": {
  "required_change_checks": [
   {
    "id": "rc1",
    "kind": "schema_valid",
    "check": {
     "t": "shape_json",
     "keys": [
      "pov_character",
      "setting",
      "tension"
     ]
    }
   },
   {
    "id": "rc2",
    "kind": "required_fact_present",
    "check": {
     "t": "present",
     "v": "Dain"
    }
   }
  ],
  "protected_text_checks": [],
  "forbidden_change_checks": [
   {
    "id": "f1",
    "kind": "forbidden_guard",
    "check": {
     "t": "absent",
     "v": "guard"
    }
   },
   {
    "id": "f2",
    "kind": "forbidden_guard",
    "check": {
     "t": "absent",
     "v": "summary"
    }
   }
  ],
  "output_shape_checks": [
   {
    "id": "sh1",
    "kind": "schema_valid",
    "check": {
     "t": "shape_json",
     "keys": [
      "pov_character",
      "setting",
      "tension"
     ]
    }
   }
  ],
  "returned_unchanged_check": {
   "normalization": {
    "trim_outer_whitespace": true,
    "normalize_line_endings": true
   },
   "comparison": "exact_after_normalization"
  },
  "partial_fix_checks": [
   "rc1",
   "rc2"
  ],
  "unauthorized_edit_checks": []
 },
 "diagnostics": {
  "instruction_position": null,
  "critical_instruction_type": "output_shape_requirement",
  "critical_instruction_ordinal": 1,
  "defect_count": 2,
  "difficulty": "medium",
  "context_length_class": "short",
  "voice_dependency": false,
  "canon_dependency": false
 },
 "gold_acceptance_requirements": {
  "contract_execution_required": true,
  "manuscript_quality_required": false,
  "acceptable_output_properties": [
   "valid JSON, exactly three keys",
   "pov_character is Dain",
   "no prose outside the JSON",
   "no invented content"
  ]
 },
 "benchmark_policy": {
  "benchmark_only": true,
  "excluded_from_training": true,
  "excluded_from_teacher_examples": true,
  "excluded_from_dataset_revision_examples": true,
  "excluded_from_preference_data": true,
  "immutable_after_freeze": true
 },
 "comprehension_probe": {
  "enabled": true,
  "expected_required_changes": 2,
  "expected_protected_elements": 0,
  "expected_forbidden_operations": 2,
  "expected_output_contract": "json"
 }
}