{
 "task_id": "nc-04",
 "task_family": "no_change_judgment",
 "title": "Dialect that isn't an error",
 "source_passage": "'I ain't going back down there,' Tam said. 'Not for you, not for nobody.' The lantern guttered between them.",
 "user_context": "Clean up the dialogue so it's grammatical.",
 "compiler_inputs": {
  "user_request": "Clean up the dialogue so it's grammatical.",
  "source_passage": "'I ain't going back down there,' Tam said. 'Not for you, not for nobody.' The lantern guttered between them.",
  "project_context": "the dialect and double negative are true to the character's voice",
  "scene_context": "",
  "canon_records": [],
  "voice_profile": "regional dialect in dialogue; narration is standard",
  "character_state": "",
  "invention_budget": "none: the dialect is intentional character voice"
 },
 "evaluation_ground_truth": {
  "required_changes": [],
  "protected_elements": [
   {
    "id": "p1",
    "text": "'Not for you, not for nobody.'"
   }
  ],
  "forbidden_changes": [
   {
    "id": "f1",
    "desc": "do not standardise the dialogue",
    "check": {
     "t": "present",
     "v": "I ain't going back down there"
    }
   },
   {
    "id": "f2",
    "desc": "do not remove the double negative",
    "check": {
     "t": "present",
     "v": "not for nobody"
    }
   }
  ],
  "authorized_spans": [
   {
    "id": "a1",
    "desc": "no span is authorized for change"
   }
  ],
  "unaffected_spans": [
   {
    "id": "u1",
    "text": "The lantern guttered between them."
   }
  ],
  "required_facts": [],
  "forbidden_facts": [],
  "expected_output_shape": "prose",
  "valid_no_change_case": true
 },
 "machine_checks": {
  "required_change_checks": [],
  "protected_text_checks": [
   {
    "id": "p1",
    "kind": "exact_preservation",
    "check": {
     "t": "preserve",
     "v": "'Not for you, not for nobody.'"
    }
   }
  ],
  "forbidden_change_checks": [
   {
    "id": "f1",
    "kind": "forbidden_guard",
    "check": {
     "t": "present",
     "v": "I ain't going back down there"
    }
   },
   {
    "id": "f2",
    "kind": "forbidden_guard",
    "check": {
     "t": "present",
     "v": "not for nobody"
    }
   }
  ],
  "output_shape_checks": [],
  "returned_unchanged_check": {
   "normalization": {
    "trim_outer_whitespace": true,
    "normalize_line_endings": true
   },
   "comparison": "exact_after_normalization"
  },
  "partial_fix_checks": [],
  "unauthorized_edit_checks": [
   {
    "id": "u1",
    "kind": "unaffected_exact",
    "check": {
     "t": "preserve",
     "v": "The lantern guttered between them."
    }
   }
  ]
 },
 "diagnostics": {
  "instruction_position": null,
  "critical_instruction_type": "no_change_judgment",
  "critical_instruction_ordinal": null,
  "defect_count": 0,
  "difficulty": "medium",
  "context_length_class": "short",
  "voice_dependency": false,
  "canon_dependency": false
 },
 "gold_acceptance_requirements": {
  "contract_execution_required": true,
  "manuscript_quality_required": true,
  "acceptable_output_properties": [
   "recognises the dialect is intentional voice, not error",
   "leaves the dialogue as written",
   "returns the passage unchanged"
  ]
 },
 "benchmark_policy": {
  "benchmark_only": true,
  "excluded_from_training": true,
  "excluded_from_teacher_examples": true,
  "excluded_from_dataset_revision_examples": true,
  "excluded_from_preference_data": true,
  "immutable_after_freeze": true
 },
 "comprehension_probe": {
  "enabled": false
 }
}