{
 "task_id": "cn-03",
 "task_family": "canon_continuation",
 "title": "Continue — magic has a cost",
 "source_passage": "Devi pressed her palm to the ward-stone and felt it wake. The lines of light spread under her fingers.",
 "user_context": "Add two or three sentences continuing the moment, consistent with how magic works here.",
 "compiler_inputs": {
  "user_request": "Add two or three sentences continuing the moment, consistent with how magic works here.",
  "source_passage": "Devi pressed her palm to the ward-stone and felt it wake. The lines of light spread under her fingers.",
  "project_context": "canon: every use of magic costs the caster memories; Devi has already lost her childhood",
  "scene_context": "",
  "canon_records": [
   "Magic costs the caster memories.",
   "Devi has already forgotten her childhood."
  ],
  "voice_profile": "",
  "character_state": "",
  "invention_budget": "low: you may show the cost; do not invent a cost-free spell"
 },
 "evaluation_ground_truth": {
  "required_changes": [
   {
    "id": "rc1",
    "desc": "the continuation must reflect that magic costs memory",
    "defect_type": "canon_fact_inclusion",
    "check": {
     "t": "present_re",
     "v": "forgot|forget|memory|memories|\\blost\\b"
    }
   }
  ],
  "protected_elements": [],
  "forbidden_changes": [
   {
    "id": "f1",
    "desc": "magic is never free here",
    "check": {
     "t": "absent",
     "v": "without cost"
    }
   },
   {
    "id": "f2",
    "desc": "do not restore her lost memories",
    "check": {
     "t": "absent",
     "v": "remembered her childhood"
    }
   }
  ],
  "authorized_spans": [
   {
    "id": "a1",
    "desc": "the continuation is authored fresh, consistent with canon"
   }
  ],
  "unaffected_spans": [],
  "required_facts": [
   "the memory-cost of magic",
   "Devi"
  ],
  "forbidden_facts": [
   "cost-free magic",
   "restored childhood memories"
  ],
  "expected_output_shape": "prose",
  "valid_no_change_case": false
 },
 "machine_checks": {
  "required_change_checks": [
   {
    "id": "rc1",
    "kind": "canon_fact_inclusion",
    "check": {
     "t": "present_re",
     "v": "forgot|forget|memory|memories|\\blost\\b"
    }
   }
  ],
  "protected_text_checks": [],
  "forbidden_change_checks": [
   {
    "id": "f1",
    "kind": "forbidden_guard",
    "check": {
     "t": "absent",
     "v": "without cost"
    }
   },
   {
    "id": "f2",
    "kind": "forbidden_guard",
    "check": {
     "t": "absent",
     "v": "remembered her childhood"
    }
   }
  ],
  "output_shape_checks": [],
  "returned_unchanged_check": {
   "normalization": {
    "trim_outer_whitespace": true,
    "normalize_line_endings": true
   },
   "comparison": "exact_after_normalization"
  },
  "partial_fix_checks": [
   "rc1"
  ],
  "unauthorized_edit_checks": []
 },
 "diagnostics": {
  "instruction_position": null,
  "critical_instruction_type": "canon_fidelity",
  "critical_instruction_ordinal": null,
  "defect_count": 1,
  "difficulty": "medium",
  "context_length_class": "short",
  "voice_dependency": false,
  "canon_dependency": true
 },
 "gold_acceptance_requirements": {
  "contract_execution_required": true,
  "manuscript_quality_required": true,
  "acceptable_output_properties": [
   "the memory cost is honoured",
   "no cost-free magic",
   "restraint over exposition"
  ]
 },
 "benchmark_policy": {
  "benchmark_only": true,
  "excluded_from_training": true,
  "excluded_from_teacher_examples": true,
  "excluded_from_dataset_revision_examples": true,
  "excluded_from_preference_data": true,
  "immutable_after_freeze": true
 },
 "comprehension_probe": {
  "enabled": false
 }
}