{
 "task_id": "fr-06",
 "task_family": "multi_constraint_focused_revision",
 "title": "Forge — keep the maker's line",
 "source_passage": "Old Sena worked the bellows and studied her phone for the time. The forge glowed like the beating heart of some vast and patient god. 'A blade remembers every hand that holds it,' she told the boy. She wiped her brow with the back of her hand. She wiped her brow with the back of her hand again. The apprentice watched the sparks climb.",
 "user_context": "Please revise. The line she tells the boy is the whole point of the chapter — do not change a word of it.",
 "compiler_inputs": {
  "user_request": "Please revise. The line she tells the boy is the whole point of the chapter — do not change a word of it.",
  "source_passage": "Old Sena worked the bellows and studied her phone for the time. The forge glowed like the beating heart of some vast and patient god. 'A blade remembers every hand that holds it,' she told the boy. She wiped her brow with the back of her hand. She wiped her brow with the back of her hand again. The apprentice watched the sparks climb.",
  "project_context": "low-fantasy village, no electricity or modern devices",
  "scene_context": "",
  "canon_records": [],
  "voice_profile": "earthy, close third, past tense",
  "character_state": "",
  "invention_budget": "none"
 },
 "evaluation_ground_truth": {
  "required_changes": [
   {
    "id": "rc1",
    "desc": "there are no phones in this world; remove it",
    "defect_type": "anachronism",
    "check": {
     "t": "absent",
     "v": "studied her phone"
    }
   },
   {
    "id": "rc2",
    "desc": "trim the overwrought forge metaphor",
    "defect_type": "overwritten_metaphor",
    "check": {
     "t": "absent",
     "v": "the beating heart of some vast and patient god"
    }
   },
   {
    "id": "rc3",
    "desc": "remove the duplicated brow-wipe cue",
    "defect_type": "repeated_body_language",
    "check": {
     "t": "absent",
     "v": "wiped her brow with the back of her hand again"
    }
   }
  ],
  "protected_elements": [
   {
    "id": "p1",
    "text": "'A blade remembers every hand that holds it,' she told the boy."
   }
  ],
  "forbidden_changes": [
   {
    "id": "f1",
    "desc": "do not rename Sena",
    "check": {
     "t": "present",
     "v": "Sena"
    }
   },
   {
    "id": "f2",
    "desc": "do not add a customer or new character",
    "check": {
     "t": "absent",
     "v": "merchant"
    }
   }
  ],
  "authorized_spans": [
   {
    "id": "a1",
    "desc": "the anachronism, the metaphor, and the duplicated cue may be rewritten"
   }
  ],
  "unaffected_spans": [
   {
    "id": "u1",
    "text": "The apprentice watched the sparks climb."
   }
  ],
  "required_facts": [],
  "forbidden_facts": [],
  "expected_output_shape": "prose",
  "valid_no_change_case": false
 },
 "machine_checks": {
  "required_change_checks": [
   {
    "id": "rc1",
    "kind": "anachronism",
    "check": {
     "t": "absent",
     "v": "studied her phone"
    }
   },
   {
    "id": "rc2",
    "kind": "overwritten_metaphor",
    "check": {
     "t": "absent",
     "v": "the beating heart of some vast and patient god"
    }
   },
   {
    "id": "rc3",
    "kind": "repeated_body_language",
    "check": {
     "t": "absent",
     "v": "wiped her brow with the back of her hand again"
    }
   }
  ],
  "protected_text_checks": [
   {
    "id": "p1",
    "kind": "exact_preservation",
    "check": {
     "t": "preserve",
     "v": "'A blade remembers every hand that holds it,' she told the boy."
    }
   }
  ],
  "forbidden_change_checks": [
   {
    "id": "f1",
    "kind": "forbidden_guard",
    "check": {
     "t": "present",
     "v": "Sena"
    }
   },
   {
    "id": "f2",
    "kind": "forbidden_guard",
    "check": {
     "t": "absent",
     "v": "merchant"
    }
   }
  ],
  "output_shape_checks": [],
  "returned_unchanged_check": {
   "normalization": {
    "trim_outer_whitespace": true,
    "normalize_line_endings": true
   },
   "comparison": "exact_after_normalization"
  },
  "partial_fix_checks": [
   "rc1",
   "rc2",
   "rc3"
  ],
  "unauthorized_edit_checks": [
   {
    "id": "u1",
    "kind": "unaffected_exact",
    "check": {
     "t": "preserve",
     "v": "The apprentice watched the sparks climb."
    }
   }
  ]
 },
 "diagnostics": {
  "instruction_position": "middle",
  "critical_instruction_type": "protected_text_rule",
  "critical_instruction_ordinal": 3,
  "defect_count": 3,
  "difficulty": "medium",
  "context_length_class": "short",
  "voice_dependency": false,
  "canon_dependency": false
 },
 "gold_acceptance_requirements": {
  "contract_execution_required": true,
  "manuscript_quality_required": true,
  "acceptable_output_properties": [
   "period-true detail replaces the phone",
   "one brow-wipe remains",
   "the maker's aphorism is untouched"
  ]
 },
 "benchmark_policy": {
  "benchmark_only": true,
  "excluded_from_training": true,
  "excluded_from_teacher_examples": true,
  "excluded_from_dataset_revision_examples": true,
  "excluded_from_preference_data": true,
  "immutable_after_freeze": true
 },
 "comprehension_probe": {
  "enabled": false
 }
}