{
 "task_id": "pt-05",
 "task_family": "protected_text_revision",
 "title": "Treaty clause — modernise nothing but the typo",
 "source_passage": "Article IV. The signatories hereby aggree to cease all hostilities at the stroke of noon. This clause shall bind their heirs and successors in perpetuity.",
 "user_context": "There's a spelling error in Article IV — correct it. Do not modernise or reword the legal language; leave the perpetuity sentence exactly as it is.",
 "compiler_inputs": {
  "user_request": "There's a spelling error in Article IV — correct it. Do not modernise or reword the legal language; leave the perpetuity sentence exactly as it is.",
  "source_passage": "Article IV. The signatories hereby aggree to cease all hostilities at the stroke of noon. This clause shall bind their heirs and successors in perpetuity.",
  "project_context": "period legal document in an alternate-history novel",
  "scene_context": "",
  "canon_records": [],
  "voice_profile": "",
  "character_state": "",
  "invention_budget": "none: fix the spelling only"
 },
 "evaluation_ground_truth": {
  "required_changes": [
   {
    "id": "rc1",
    "desc": "'aggree' is misspelled; it should be 'agree'",
    "defect_type": "required_correction",
    "check": {
     "t": "absent",
     "v": "aggree"
    }
   }
  ],
  "protected_elements": [
   {
    "id": "p1",
    "text": "This clause shall bind their heirs and successors in perpetuity."
   }
  ],
  "forbidden_changes": [
   {
    "id": "f1",
    "desc": "keep the perpetuity sentence",
    "check": {
     "t": "present",
     "v": "bind their heirs and successors in perpetuity"
    }
   },
   {
    "id": "f2",
    "desc": "do not add a new article",
    "check": {
     "t": "absent",
     "v": "Article V"
    }
   }
  ],
  "authorized_spans": [
   {
    "id": "a1",
    "desc": "only the misspelling may change"
   }
  ],
  "unaffected_spans": [
   {
    "id": "u1",
    "text": "at the stroke of noon"
   }
  ],
  "required_facts": [
   "agree to cease all hostilities"
  ],
  "forbidden_facts": [],
  "expected_output_shape": "prose",
  "valid_no_change_case": false
 },
 "machine_checks": {
  "required_change_checks": [
   {
    "id": "rc1",
    "kind": "required_correction",
    "check": {
     "t": "absent",
     "v": "aggree"
    }
   }
  ],
  "protected_text_checks": [
   {
    "id": "p1",
    "kind": "exact_preservation",
    "check": {
     "t": "preserve",
     "v": "This clause shall bind their heirs and successors in perpetuity."
    }
   }
  ],
  "forbidden_change_checks": [
   {
    "id": "f1",
    "kind": "forbidden_guard",
    "check": {
     "t": "present",
     "v": "bind their heirs and successors in perpetuity"
    }
   },
   {
    "id": "f2",
    "kind": "forbidden_guard",
    "check": {
     "t": "absent",
     "v": "Article V"
    }
   }
  ],
  "output_shape_checks": [],
  "returned_unchanged_check": {
   "normalization": {
    "trim_outer_whitespace": true,
    "normalize_line_endings": true
   },
   "comparison": "exact_after_normalization"
  },
  "partial_fix_checks": [
   "rc1"
  ],
  "unauthorized_edit_checks": [
   {
    "id": "u1",
    "kind": "unaffected_exact",
    "check": {
     "t": "preserve",
     "v": "at the stroke of noon"
    }
   }
  ]
 },
 "diagnostics": {
  "instruction_position": null,
  "critical_instruction_type": "required_correction",
  "critical_instruction_ordinal": 1,
  "defect_count": 1,
  "difficulty": "medium",
  "context_length_class": "short",
  "voice_dependency": false,
  "canon_dependency": false
 },
 "gold_acceptance_requirements": {
  "contract_execution_required": true,
  "manuscript_quality_required": true,
  "acceptable_output_properties": [
   "spelling corrected to 'agree'",
   "archaic legal register preserved",
   "perpetuity clause verbatim"
  ]
 },
 "benchmark_policy": {
  "benchmark_only": true,
  "excluded_from_training": true,
  "excluded_from_teacher_examples": true,
  "excluded_from_dataset_revision_examples": true,
  "excluded_from_preference_data": true,
  "immutable_after_freeze": true
 },
 "comprehension_probe": {
  "enabled": false
 }
}